cwe_id,cwe_name,ai_prevalence,ai_prevalence_score,affected_generators,real_cve_examples,research_source,source_url,mitigation,example_languages
CWE-78,OS Command Injection,High,85,"GitHub Copilot;ChatGPT;Amazon CodeWhisperer;Codeium","CVE-2025-53773;CVE-2024-6387;CVE-2024-3094","Pearce et al., IEEE S&P 2022",https://arxiv.org/abs/2108.09293,"Input validation; subprocess with shell=False","Python;JavaScript;Bash"
CWE-89,SQL Injection,High,88,"GitHub Copilot;ChatGPT;Google Gemini Code Assist;Cursor","CVE-2024-24401;CVE-2025-24667;CVE-2024-27956;CVE-2024-22120","Sandoval et al., USENIX Security 2023",https://arxiv.org/abs/2208.09727,"Parameterized queries; ORM usage","Python;Java;PHP;JavaScript"
CWE-79,Cross-Site Scripting (XSS),High,82,"GitHub Copilot;ChatGPT;Cursor;Tabnine","CVE-2024-45801;CVE-2024-43799;CVE-2025-55182;CVE-2024-38856","Tony et al., LLMSecEval, MSR 2023",https://arxiv.org/abs/2303.09384,"Output encoding; CSP headers; DOMPurify","JavaScript;TypeScript;Python;PHP"
CWE-798,Use of Hard-coded Credentials,Critical,90,"GitHub Copilot;ChatGPT;Amazon CodeWhisperer;Codeium;Cursor","CVE-2024-29651;CVE-2024-23334;CVE-2025-32711","Niu et al., CodexLeaks, USENIX Security 2023",https://arxiv.org/abs/2304.07900,"Secret scanning in CI/CD; env var enforcement",All
CWE-327,Use of Broken Cryptographic Algorithm,High,80,"GitHub Copilot;ChatGPT;Google Gemini Code Assist","CVE-2024-24789;CVE-2024-3596","Pearce et al., IEEE S&P 2022",https://arxiv.org/abs/2108.09293,"Crypto linting rules; SAST rules","Python;Java;Go;C++"
CWE-22,Path Traversal,Medium,72,"GitHub Copilot;ChatGPT;Cursor","CVE-2024-4577;CVE-2025-59944;CVE-2024-21733","He & Vechev, CCS 2023",https://arxiv.org/abs/2302.05319,"Path canonicalization; chroot/sandbox","Python;Java;Node.js;Go"
CWE-502,Deserialization of Untrusted Data,Medium,68,"GitHub Copilot;ChatGPT","CVE-2024-3651;CVE-2024-34064","Tony et al., LLMSecEval, MSR 2023",https://arxiv.org/abs/2303.09384,"yaml.safe_load(); input validation","Python;Java;PHP"
CWE-476,NULL Pointer Dereference,Medium,65,"GitHub Copilot;ChatGPT;Amazon CodeWhisperer","CVE-2024-26461;CVE-2024-1086","Pearce et al., IEEE S&P 2022",https://arxiv.org/abs/2108.09293,"Static analysis; smart pointers","C;C++;Rust"
CWE-200,Exposure of Sensitive Information,Medium,70,"GitHub Copilot;ChatGPT;Cursor;Codeium","CVE-2025-32711;CVE-2024-42005;CVE-2024-45388","Sandoval et al., USENIX Security 2023",https://arxiv.org/abs/2208.09727,"Custom error handlers; structured logging","Python;Java;JavaScript;Go"
CWE-862,Missing Authorization,High,78,"GitHub Copilot;ChatGPT;Cursor;Google Gemini Code Assist","CVE-2024-38856;CVE-2024-45195;CVE-2024-6235","He & Vechev, CCS 2023",https://arxiv.org/abs/2302.05319,"Authorization middleware; RBAC frameworks","Python;JavaScript;Java;Go"
CWE-119,Buffer Overflow,Medium,62,"GitHub Copilot;ChatGPT","CVE-2024-21762;CVE-2024-3400;CVE-2024-6387","Pearce et al., IEEE S&P 2022",https://arxiv.org/abs/2108.09293,"Bounds checking; AddressSanitizer","C;C++"
CWE-918,Server-Side Request Forgery (SSRF),Medium,66,"GitHub Copilot;ChatGPT;Cursor","CVE-2024-21893;CVE-2024-27198","Tony et al., LLMSecEval, MSR 2023",https://arxiv.org/abs/2303.09384,"URL allowlisting; network segmentation","Python;JavaScript;Java"
CWE-94,Improper Control of Code Generation,High,75,"GitHub Copilot;Cursor;Windsurf","CVE-2025-54136;CVE-2025-53773;CVE-2025-34291","Multiple vendor advisories 2025",https://nvd.nist.gov,"Sandboxed execution; prompt injection defenses",All
